id,question_id,created,updated,content,creator,is_spam,num_helpful,num_unhelpful
1817107,1580696,2026-05-09 19:51:31 -0700,2026-05-10 06:43:40 -0700,"<p>Sorry for being tardy. Real life intrudes. </p><p>My ""technical"" suggestion is to manually delete the index files for that folder. It essentially accomplishes the same thing that repairing the folder does but slightly differently. Here's how: </p><p>- Right-click on the folder name and choose ""Properties"" from the context menu. Make a note of the Location. If it's an IMAP account it will look something like </p><p>	imap://(the account user name)@(the account server name)/(local folder name) </p><p>If it's a POP3 account it will look like: </p><p>	mailbox://(the account user name)@(the local folder name)/(the local folder file name) </p><p>- In Thunderbird, go to &lt;Help | Troubleshooting Information&gt; . Scroll down to ""Profile Folder"" and click the ""Open Folder"" button. This will open your system file browser inside your Thunderbird Profile. </p><p>- Close down Thunderbird. </p><p>- If it's an IMAP account, navigate to the folder ImapMail\(the account in question, as found in the Folder Properties above).  </p><p>If it's a POP3 account, navigate to the folder Mail\(the account in question, as found in the Folder Properties above). </p><p>Here you will see files representing your various folders. There will be a pair for each folder, one with no extension, the other with a .MSF extension. The MSF ones are the indexes. </p><p>- Delete the MSF file for that folder *ONLY* - be careful to not delete any others! The MSF index file will be recreated when you next start Thunderbird. Your mixed-up headers should be correct again. </p> <hr> <p>This whole business only corrects the symptom. That the indexes keep getting corrupted is the real problem. If this persists, it's a sign that there's something else going on. The most likely cause is your Anti-virus, as was mentioned by christ1 . It could also be general computer problems, such as a failing hard disc or file system corruption, although I would expect you would be having other computer problems besides just this. </p>",rednoise,False,0,0
1816910,1580698,2026-05-08 20:46:26 -0700,2026-05-08 20:46:26 -0700,"<p>You're not the only one. This has been an ongoing issue with Thunderbird and Google Calendar for years. Local calendars work fine. Maybe other on-line calendar services. But Google... nope. It seems to be a permissions issue on Google's side that nobody has been able to surmount, as far as I know. There have been a number of suggested fixes and workarounds, none of them I have found to work. The only solution I have found has been to disable notifications for that calendar (uncheck the ""Show Reminders"" option from that calendar's right-click Properties context menu.) </p>",rednoise,False,0,0
1817460,1580842,2026-05-11 08:09:37 -0700,2026-05-11 08:09:37 -0700,<p>I am 82 years old and cannot understand most of the reply </p><p>I do have Purevpn but only use it it when I need to access British TV in Spain </p><p>I have used Thunderbird for Many Years and used it in Spain for 10 Years </p><p>And it was OK until Google poked its nose in </p><p>have you got one of the old versians of Thunderbird that used to work perfect on my Computer without Google </p><p>Yours Sincerely </p><p>Ron Goldthorpe </p>,310jupiter1,False,0,0
1817242,1580842,2026-05-10 09:53:18 -0700,2026-05-10 09:54:23 -0700,"<p>Make sure cookies are allowed <strong>in Thunderbird</strong>. Do not use a VPN while authenticating. Don't run a local web server or any other service listening on TCP port 80 while  authenticating. </p><p>Also see <a href=""https://support.mozilla.org/kb/automatic-conversion-google-mail-accounts-oauth20"" rel=""nofollow"">https://support.mozilla.org/kb/automatic-conversion-google-mail-accounts-oauth20</a> </p>",christ1,False,0,0
1817243,1580842,2026-05-10 09:55:00 -0700,2026-05-10 09:55:00 -0700,"<p>I am struggling to put this in order.  So I will concentrate on what I think is the issue. </p><p><img src=""https://assets-prod.sumo.prod.webservices.mozgcp.net/media/uploads/images/2026-05-10-02-02-52-abeaf0.png""> This is the settings post Thunderbird fetching them from here. <a href=""https://autoconfig.thunderbird.net/v1.1/gmail.com"" rel=""nofollow"">https://autoconfig.thunderbird.net/v1.1/gmail.com</a> </p><p><img src=""https://assets-prod.sumo.prod.webservices.mozgcp.net/media/uploads/images/2026-05-10-02-03-44-c7668b.png""> This is Thunderbird telling you it can not connect to the mail server  </p><p>Right after you told is everything was OK. <img src=""https://assets-prod.sumo.prod.webservices.mozgcp.net/media/uploads/images/2026-05-10-02-03-05-90960c.png""> </p><p>Now what we have is the first image is a data download.  Nothing else,  but it does show to me that your firewall is not blocking Thunderbird from accessing the internet. </p><p>The last image is actually a webpage accessed served from Google via a browser and it does not access your mail at all.  Hence you confusion that is allows access and then refuses in the second image where the first real attempt is made to access you email on the mail server. </p><p>The next step is check in the saved passwords that there is an entry for the account as oauth.  What is stored as a password is an oauth authentication token issued in the web part of the authentoication process.  What we are checking is it actually got beck to Thunderbird.   </p><p>Some things can prevent that, including antivirus blocking the localhost that is used to pass the information back to Thunderbird from the browser. Development environments and other software that monitor and consume data on the HTTP ports such as web server implementations can also see the pass back fail.  So check there is an entry. </p><p>Next look to your antivirus product.  If is has an option to scan email turn it off.  They are terribly keen to just stop the flow by using self signed encryption certificates to hack the connection.  About the only antivirus 5that does not cause email issues routinely is defender,  by virtue of the fact it does not scan email at all. </p><p>So why has google taken over?  Because they championed the use of oauth authentication and it is a web protocol,  but that is not why you email is not working as you expect.   </p><p>One outcome of this is Thunderbird never actually has your Google password stored anywhere.  You enter it into a Google web page and they issue a token to Thunderbird that Thunderbird uses going forward to connect, until Google decides they again need your permission.,  This does appear to be quite frequently for those using a VPN. </p>",MattAuSupport,False,0,1
1817087,1580842,2026-05-09 18:26:22 -0700,2026-05-09 18:26:22 -0700,<p>Try again and do NOT enter password until prompted for it by Google. That often works. </p>,davidsk,False,0,0
1817232,1580842,2026-05-10 09:04:49 -0700,2026-05-10 09:04:49 -0700,<p>it does not work just takes me round in circles </p><p>It used to be straight forward I reinstalled many times and never seen The Google page come up until I upgraded about 4 years ago </p><p>Since then my Plusnet email has not worked at all in Spain but because I have not updated in England both my Plusnet and google accounts work as always </p><p>But now I have to access my Google account via there website and also plusnet via their own website </p><p>I like your  set up much better when it works BUT DOES NOT WORK AT ALL WHY HAS GOOGLE TAKEN OVER </p><p>I have taken screen shots of every step from clicking on Thunderbird </p><p>Your Sincerely Ron Goldthorpe </p>,310jupiter1,False,0,0
1817121,1580856,2026-05-09 20:35:12 -0700,2026-05-09 20:35:12 -0700,"<p>Possibly, if you show screenshots of the account that is not working, some suggestions will come. screenshots of the server settings pane and the SMTP server settings pane should help. thank you </p>",davidsk,False,0,0
1817192,1580856,2026-05-10 04:38:14 -0700,2026-05-10 04:38:28 -0700,"<em><p>Stanley Friesen <a href=""#answer-1817135"" rel=""nofollow"">said</a></p></em> <blockquote>I am not sure how to get to the other. </blockquote> <p>To get there You either went via the account settings tab and selected (outgoing server SMTP) instead of the account or stated in the identity part of the account settings and clicked on the ""Edit outgoing server"" button. </p><p>Nope clicking the edit outgoing server button does not open the list of outgoing account you have in the background,  so I suggest you look at the list of accounts on the left where you selected the outgoing server (SMTP) entry.  Probably above the entry you chose in the list with the email address showing usually </p>",MattAuSupport,False,0,0
1817126,1580856,2026-05-09 20:47:42 -0700,2026-05-09 20:47:42 -0700,"<p>OK, I have added a screen shot of the account screen with the account in question. The information in there is correct. Is that what you meant by ""server settings pane""? Or is that something else? </p>",sarima,False,0,0
1817282,1580856,2026-05-10 13:48:45 -0700,2026-05-10 13:48:45 -0700,"<p>OK, so now I need to import my local folders, filters and address book from the previous ""machine"". I have access to the old user account folder, including AppData. So, can I simply copy the stuff over, or do I need to do something else? </p>",sarima,False,0,0
1817281,1580856,2026-05-10 13:35:23 -0700,2026-05-10 13:35:23 -0700,"<p>Ah, I see it now. Got it. </p>",sarima,False,0,0
1817280,1580856,2026-05-10 13:33:25 -0700,2026-05-10 13:33:25 -0700,<p>How do I add an incoming server? </p>,sarima,False,0,0
1817132,1580856,2026-05-09 21:15:33 -0700,2026-05-09 21:15:33 -0700,<p>that's the outgoing server settings. the other is at the 'server settings; pane for the account.. </p>,davidsk,False,0,0
1817135,1580856,2026-05-09 21:29:32 -0700,2026-05-09 21:29:32 -0700,"<p>I am not sure how to get to the other. Also, with this I would at least expect the New Message button to be active, but it isn't. </p>",sarima,False,0,0
1817316,1580858,2026-05-10 16:23:54 -0700,2026-05-10 16:23:54 -0700,"<p>Matt, to answer your question about the exact error message I was getting yesterday, I've attached a screenshot of what I got when trying to send a message. </p><p>As I mentioned, as of this AM, the issue (fingers crossed) seems to be resolved. </p>",Bartholo,False,0,0
1817285,1580858,2026-05-10 14:20:17 -0700,2026-05-10 14:20:17 -0700,"<p>Matt,  </p><p>I really appreciate your detailed and helpful reply. The good news is that Spectrum must've come up with a fix overnight because this morning (halleluja!) my email seems (so far at least) to be working. If this happens again, I will have the benefit of your analysis to help guide me---and I will no doubt be posting here again.  </p><p>Also, you asked about my anti-virus: it's Microsoft Defender, supplemented by weekly (or more) manual scans by Malwarebytes (free version). </p><p>Let me ask something related to all this. You mention the problems of Spectrum customers (like me) who have the old <a href=""http://rr.com"" rel=""nofollow"">rr.com</a> (Roadrunner) email addresses. I've read about this on the web as well. I dread having to change my <a href=""http://rr.com"" rel=""nofollow"">rr.com</a> email addresses as I've had the same ones for decades and they're on file with a huge number of vendors, accounts, etc., with whom I interact. That said, if I continue to have this kind of problem, I'd have to consider it. </p><p>So 2-part question: Should I consider trying to change my Spectrum email address to something more current? I think maybe they're now using @spectrum.net? </p><p>Or, if I finally motivate myself to cut the cord with Spectrum altogether, which other email providers work best with Thunderbird? And if I go that route, will the 1000s of messages I have stored in my Thunderbird folders survive the transition? </p><p>Many thanks for your help, </p><p>Andrew </p>",Bartholo,False,0,0
1817307,1580858,2026-05-10 15:47:15 -0700,2026-05-10 15:47:15 -0700,"<p>Both IMAP and POP can be preservied, but POP is easier. All you need to do with POP message folders is to exit thunderbird, locate the POP message folders in profile (located normally at Mail\&lt;POP account&gt; folder) and then copy the message files (such as inbox, sent) to the Mail\Local Folders folder. It's that simple, Again, if/when you do this, go slowly. </p>",davidsk,False,1,0
1817315,1580858,2026-05-10 16:21:19 -0700,2026-05-10 16:21:19 -0700,"<p>Thanks, David. POP still has some advantages, I guess. </p>",Bartholo,False,0,0
1817133,1580858,2026-05-09 21:20:18 -0700,2026-05-09 21:20:18 -0700,"<p>David, thanks for your reply and explanation. I was just on the phone with Spectrum tech support and they can't figure it out either. The rep said, though, that she thinks there was some discussion at her shop earlier today about problems with Thunderbird and Outlook. She created a ticket for their engineers and I'm hoping they can figure this out. </p>",Bartholo,False,0,0
1817153,1580858,2026-05-10 01:45:27 -0700,2026-05-10 01:45:27 -0700,"<p>I am going to disact this as the bits sort of need to be addressed in context. </p> <em><p>Andrew <a href=""#question-1580858"" rel=""nofollow"">said</a></p></em> <blockquote>I'm getting ""Thunderbird can't connect to the server"" message, so I can't download messages. However, a message or two will finally download 1-2 hours later.  </blockquote> <p>My ears just pricked up and asked what is causing things tobog down to the point it takes a couple of hours to clear the logjam. </p> <blockquote> Same problem on 2 laptops, both running Windows 11. But I know my emails are coming in as I can view them via Spectrum webmail.  </blockquote> <p>That is almost like saying you can view Ebay or Google.  Spectrum webmail is by definition a web page.  You never get anywhere near the mail protocols that a mail client used to download mail.  So like when you go to your sink and turn on the hot water,  then the cold.  Both cause the water meter to tick over,   but most of the plumbing the water goes through  is separated from that point to where it actually comes out of the tap.  It is the same water but how you get it is entirely different.  In this circumstance,  both things get email </p> <blockquote> So the problem isn't the Spectrum servers.  </blockquote> <p>Not necessarily correct.  Unfortunately Spectrum have had a fairly long history now of changing things for their legacy roadrunner customers that causes mail client failure and they appear to be largely oblivious. </p> <blockquote> I've logged out and back into Thunderbird, and have re-booted my laptops. No luck. What to do?  </blockquote> <p>More on that later </p> <blockquote> Also, is there a place to report problems directly to Thunderbird? </blockquote> <p>This is the Thunderbird user support forum,  it is what is offered by Mozilla for support and it is volunteer based by Thunderbird users.  There is no ring the script reading monkey and doing the mindless things the script suggests.  Generally the requirement for user support lines is more about clarity of speach than any knowledge of the subject matter.  Corporates have a script for that,  or a policy that lets them say they bow out. </p> <blockquote> I've logged out and back into Thunderbird, and have re-booted my laptops. No luck. What to do?  </blockquote> <p>What is needed is to determine exactly what the root cause of the issue is.  YOu having what probably amounts to two identical laptops exhibiting the same issue is not really germane.  It is a data point,  but not all that relevant as the software will be your same chosen software,  and most of the setup will be identical because we rarely like to have to change mental gears when we change devices. </p><p>So the first and really the most crucial question is what form of antivirus do you use? I have a feeling that this is a very likely cause of your issue.  Antivirus product are unfortunately slow, buggy and prone to failure.  The same thing has been crashing Norton's now for about 10 years.  Have they fixed it.  I don't think so, or this forum would not still be receiving questions from folk about the same old collection of mail downloading all the time and no new mail.  The clues can be subtly.  Antivirus does not pop up a window and say I have crashed,  you are one your own.  They are fast to point the finger at email and downloads,  but never do they announce their own failure to do their job. </p><p>You could check in account settings and make sure the accounts are only polled for new messages at startup and again every 15 minutes,  that by itself can alleviate a lot of issues as race conditions begin to occur when mail is fetched to frequently.  There is just not enough time between for everything to settle down. 15 minute is the time originally set by Hotmail as the most frequent login they would honour.  I do not know if that is still their policy  but with IMAP account and immediate server notofications a genral check every 15 minutes should be more than adequate. </p><p><br> The next issue is the actual antivirus,  I have complained a lot but said little.  First disable any email scanning and SCAM and SPAM detection tools.  Those latter two are more problematic that the general scanning  but all three are unnecessary,  or Microsoft's defender would have them as features and it does not. </p><p>Try disabling your antivirus entirely.  Having a third party products locking up the storage files every few minutes (every-time they change)  to undertake a scan can in itself be a problem.  Thunderbird defaults to huge files, especially for the inbox  where 4 or more gigabytes is common.  This is not compatible with most antivirus scanners scanning multiple times a minute. File contention is a real thing. </p><p>Now what is the error message in its entirety,  verbatim,  not your interpretation of what is says. ( a screen shot would be good) </p><p>You also need to check the activity manager in Thunderbird to see what Thunderbird ""thinks"" it is doing. Double clicking the status bar at the bottom of the page will open the dialog listing activities.  Not failed connections may block the first part of the window with their yellow triangles.  What do any messages of this nature say? </p><p>Scroll down to the other icons and have a look there. Are there ""no messages to download"" and other notifications shown? </p><p>NOw the next step. </p><p>Open the error console. (ctrl+Shift+J) Use the trash icon on its toolbar to clear it. Attempt top get you mail by pressing shift+F5 What error messages appear in the console?  Right click and select copy all message,  come to this forum and in a reply on this topic paste in what you copied. </p><p><br> That will do for now I think.  I have probably said more than enough. </p>",MattAuSupport,False,1,0
1817120,1580858,2026-05-09 20:33:29 -0700,2026-05-09 20:33:29 -0700,"<p>Connections via PC email clients is not the same route as via the web browser. All thunderbird can do is send a request through network for a connection. It is then on the spectrum server to respond. You might try reducing number of connections to the server. This is a network issue, not a thunderbird one. And, that it is happening on two laptops, plus a desktop confirms that the issue is separate. </p>",davidsk,False,1,0
1817287,1580858,2026-05-10 14:31:47 -0700,2026-05-10 14:31:47 -0700,"<p>I will jump in with a suggestion, one that I have frequently offered... - avoid long-term commitment to the 'free' email account that is provided by an ISP, whether spectrum or version or other. the day may come when you want to switch ISPs and that would lock you in. I have been active here for four years, and daily see posts from users who are not getting assistance or information from their ISPs regarding email. It's not their focus.  - instead, there are several free services that work well (gmail, outlook, gmx) and many fee-paid ones, such as <a href=""http://fastmail.com"" rel=""nofollow"">fastmail.com</a> and <a href=""http://mail.com"" rel=""nofollow"">mail.com</a>  - and others.  - verify that spectrum offers a solid forwarding service and autoreply to senders.  - if you make the switch, plan to keep spectrum for a minimum of a year to allow time for transition  - messages on spectrum can be safely downloaded to PC and then uploaded to the new account (there are several steps in that and I don't go into that here).   </p><p>Matt has more in-depth knowledge on the various providers. My preference of the free ones is <a href=""http://gmx.com"" rel=""nofollow"">gmx.com</a>, followed by outlook, since a strength of outlook is a decent web interface when thunerbird is not available. I shudder everytime I need to log onto gmail. To me, it's a zoo.  Just my thoughts.... :) </p>",davidsk,False,1,0
1817288,1580858,2026-05-10 14:42:17 -0700,2026-05-10 14:42:17 -0700,"<p>David, thanks for your reply. I share your dislike of gmail. I actually have a gmail account but never use it because I just don't like the interface and have trouble finding simple things. But if I used gmail---or any other email provider along with Thunderbird, wouldn't I always be using the Thunderbird interface?  </p><p>Also, would the countless messages I have in my Thunderbird folders survive the transition from Spectrum to a new provider? They're stored on my hard drive so I'm thinking yes? </p>",Bartholo,False,0,0
1817290,1580858,2026-05-10 15:05:13 -0700,2026-05-10 15:05:13 -0700,"<p>The good news is that thunderbird uses standard setup. Thunderbird hand'es all accounts that use IMAP or POP. The setup for thunderbird works the same in thebat, mailbird, emclient, and any other email client that supports IMAP or POP. Also, gmx and outlook have workable interfaces with any browser. And all fee-paid providers provide good interfaces and more. For example, I have a paid service with netaddress and that gives me the ability to send messages for the future, a controlled spam filter, and automatic retention of deleted messages for several months (a feature I use regularly). Fee-paid services also provide direct to user support. Yes, the fact that your messages are already on your PC ensures they would surive. BUT, ask for help prior to a switch. I routinely see  users closing IMAP accounts and losing al they messages. </p>",davidsk,False,1,0
1817296,1580858,2026-05-10 15:33:19 -0700,2026-05-10 15:33:19 -0700,"<p>David, thanks for your reply. As for preserving my stored messages, does the fact that I use POP make a difference? </p>",Bartholo,False,0,0
1817123,1580861,2026-05-09 20:40:43 -0700,2026-05-09 20:40:43 -0700,"<p>This is usually a timeout issue, trying to get response from server. you might try reducing number of connections in server settings, but that is just a guess. If network is slow, thunderbird can do little. </p>",davidsk,False,0,0
1817604,1580862,2026-05-11 19:03:51 -0700,2026-05-11 19:03:51 -0700,<p>Matt - you are a lifesaver! I owe you a cup of coffee! Best regards - Jim Warters </p>,jawarters,False,0,0
1817168,1580862,2026-05-10 02:56:11 -0700,2026-05-10 02:56:11 -0700,"<p>Ok I did not read everything.  Sorry but time is short. </p><p>Yahoo use cookies to manage multiple oauth accounts and reuses them for multiple accounts (ouch).  So you need to change a hidden preference to force Yahoo to use new cookies.  That is create a private browser window as it is called in Firefox. (it is in essence the same code as Firefox uses to display a window shared by Thunderbird.) </p> <ol><li> Use the <a href=""/en-US/kb/config-editor"" rel=""nofollow"">Config Editor</a> to modify the hidden preference mailnews.oauth.usePrivateBrowser to true and restart Thunderbird </li><li> Delete the oauth tokens in the password manager for the troublesome accounts. </li></ol> <p>See <a href=""https://support.mozilla.org/en-US/kb/thunderbird-and-yahoo"" rel=""nofollow"">https://support.mozilla.org/en-US/kb/thunderbird-and-yahoo</a> under the tag ""Configure a Thunderbird preference to make multiple account work"". </p>",MattAuSupport,False,1,0
1817350,1580863,2026-05-10 20:05:41 -0700,2026-05-10 20:05:41 -0700,"<p>I believe the problem was Spectrum Internet was so slow that emails timed out. I gave up yesterday and today I opened only TB, not FF and everything is fine now. I looked at the post you recommended but although problem is very similar I didn't notice any solution provided. Thanks for trying to help though, Matt and sorry I wasted everyone's time when it wasn't even a TB problem! </p>",arlener,False,0,0
1817166,1580863,2026-05-10 02:43:28 -0700,2026-05-10 02:43:28 -0700,"<p>Please see <a href=""https://support.mozilla.org/en-US/questions/1580877#answer-1817163"" rel=""nofollow"">https://support.mozilla.org/en-US/questions/1580877#answer-1817163</a> </p><p>Are you also using POP to collect your mail? </p>",MattAuSupport,False,0,0
