id,question_id,created,updated,content,creator,is_spam,num_helpful,num_unhelpful
1817051,1580121,2026-05-09 16:20:39 -0700,2026-05-09 16:20:39 -0700,"<p><em>re : I use Apple Mail to set emails to archive for brand new just received emails </em> <em>re: Those archived Apple Mails download in POP,</em> </p><p>It's not possible to download an archived email as that email would have no labels and would only be in the gmail 'All Mail' folder.  It would not be in the Inbox if it's archived. Therefore the logic dictates, it's still in the 'Inbox' as Pop account can only access the server Inbox. </p><p>Please do the following and make sure to do it all in the order I mention <strong>Using phone and Apple Mail</strong> -  In 'Inbox' - select an email - remember it and click on 'Archive' icon. </p><p>If you select the 'Archive' folder option:  Does it say '<strong>Archive - Google (All Mail)'</strong>  at the top above the list of emails? Post an image showing contents of Archive and  the 'All Mail' list and tell me/highlight which one you archived. It might sound obvious but All Mail is all your emails not just archived. Hence you need to show me which one was archived. </p><p>Do you see a folder called 'Important' - if yes,  select it - do you see that 'archived' email in the Important folder ? Reselect the 'Inbox' and check it - do you now see that archived email reappear in the Inbox ? </p><p>it would be helpful to post an image showing what you see in Apple Mail.  I'm talking about the list of folders.  I'm wondering if you have more than one label being applied to the email. </p><p>Now you need to use the Laptop and logon to your gmail webmail account via a browser like Firefox or Chrome or Edge etc.  So directly seeing what is on the server via gmail. Select the 'Inbox' and look for that 'archived' email Is that 'archived' email still displaying in the 'Inbox' in the webmail account ? </p>",Toad-Hall,False,0,0
1816326,1580121,2026-05-06 13:19:00 -0700,2026-05-06 13:19:00 -0700,"<p>Thanks for the great explanation. </p><p>Here is what happens and I believe your reply explains it: </p><p>POP is on my desktop and the permanent  email storage. IMAP is on my laptop and temporarily allows me to access emails when I’m traveling.  Webmail is Apple Mail on my iPhone (do I have that right?) and temporarily allows me to access emails when I’m traveling. Gmail is the server, holding all my emails. </p><p>If I read an email in IMAP first,  POP downloads it. If I read an email in webmail first, POP downloads it. If I read an email in POP first, IMAP and webmail do not download it. This works great because IMAP and webmail allow me to read/reply/delete new emails  while traveling and the read/reply mail winds up on my desktop when I get home. The deleted emails remain deleted, roll off the server, and do not download with POP. </p><p>The issue is archive. I view archive as emails I do not need in POP, similar to deleted emails, but I want them to remain on the server instead of rolling off as deleted emails do. </p><p>When I archive an email in IMAP or webmail first,  POP downloads it, clogging up my inbox with emails I read already but decided are not needed. </p><p>I was hoping I could archive in IMAP and webmail but not download it in POP.  </p><p>Art </p>",damurrs,False,0,0
1816195,1580121,2026-05-05 18:57:32 -0700,2026-05-05 18:57:32 -0700,"<p>POP is doing what you want, downloading all messages. That's what it does. </p>",davidsk,False,0,0
1816218,1580121,2026-05-05 21:33:10 -0700,2026-05-05 21:33:10 -0700,"<p>I am not the expert on this, but I think your challenge is that you use Gmail, which does not have specific folders. As such, all mail that hasn't been deleted is subject to the POP download. If using another account, where the messages were physically transferred to another folder, there might not be a problem. And, maybe someone else here has a workaround. Good luck. :) </p>",davidsk,False,0,0
1816215,1580121,2026-05-05 21:23:45 -0700,2026-05-05 21:23:45 -0700,"<p>Hi David, </p><p>POP is not doing what I want. I want it to download emails that have not been archived, just as it does not download deleted emails. </p><p>Art </p>",damurrs,False,0,0
1816301,1580121,2026-05-06 10:24:46 -0700,2026-05-06 10:27:55 -0700,"<p>POP accounts can only access the server Inbox and download whatever is in the server Inbox into the Pop account Inbox. There is no synchronisation between any Pop folder or any server folder. So if the emails are in the server Inbox when you start up Thunderbird on the desktop, then it will download whatever is in server Inbox at that time. Pop accounts store emails on your computer usually in mbox text files where emails are written to the file one after the other. These files are completely independent of the server. When emails are downloaded, a record is kept in a 'popstate.dat' file. That means the next time Pop account accesses server Inbox, it will not download anything previously downloaded.  </p><p>IMAP accounts operate in a different way. All imap folders synchronise with server folders and can only display whatever is on the server.  Even if you choose to download full copies into the mbox files; which can used to create a backup, you cannot believe those mbox files are truelly independent copies because they synchronise with the server. </p><p>Webmail: Gmail stores all emails - incoming, sent, archived - everything in one location called 'All Mail'. Gmail understands this is completely useless for general use, so gmail invented 'labels'. Labels are just a form of a tag which gets applied to the emails in the 'All Mail' folder thus allowing an email to be seen in whatever label has that name. It therefore looks like a more normal 'folder' type structure eg: Inbox, Sent Mail, Spam, etc. It also means more than one label can be applied to a single email, thus allowing it to display in more than one 'label' folder.  When an email is archived, gmail simply removes all 'labels', so email is still in same location in the 'All Mail' but has no labels. That's a real pain if you want to find anything archived. Personally, I created a 'label' called 'Archived', then at least I can find stuff I've archived. It's so much easier to locate a load of old archived mail and choose to delete them than try to find them in the 'All Mail' folder. </p><p>POP account: If you delete an email in a Pop account, it's impossible to put that email into the Gmail server Trash folder as there is no synchronisation between a Pop account and the server.  If Pop Inbox is compacted then it's possible the settings may inform the server to stop displaying in Inbox. In other words, gmail reads this as remove the Inbox label and archive. Gmail does not delete anything deleted in a Pop account.  If you 'Archive' an email in a Pop account, the emails is moved into an 'Archives' folder. You would compact the Pop Inbox to remove old traces of moved or deleted emails. These folders are independent of server, so moving or deleting any email has no effect on the server. </p><p>IMAP account: When using the IMAP account, if you delete an email, then it should auto get put into the gmail Trash folder and because there is full synchronisation, gmail understands it's been deleted and therefore will delete the stored email from the 'All MAil' folder. If you click on 'Archive' then gmail automatically reads this as 'remove all labels', so email disappears from all folders it was previously displaying in, but keep in 'All Mail'. But...that's assuming you have not created an 'Archive' foldre/label like me. Otherwise it will apply the 'label' 'Archive' and make a visible view of email in Archive. </p><p><br> <em>re :POP is not doing what I want. I want it to download emails that have <strong>not been archived</strong>, just as it does not download deleted emails.</em> </p><p>If it's not downloading emails that are new in server Inbox and are still in server Inbox, then there is a problem. If emails are in server Inbox' then they have not been archived. </p><p>Senario: If you allow the Pop account to access the server first, it will download whatever is in the Inbox that has no been downloaded previously. </p><p>If you access the Imap account first and choose to delete some emails from Inbox and maybe 'Archive' some older emails from Inbox - how does this effect what is downloaded to Pop ? </p><p>It depends - If you have new emails since Pop last accessed server, then they have not been downloaded to Pop at this point. If you delete or move any of those 'new' emails out of the Inbox, then when Pop does get access - it will not be able to download anything 'new' that you have moved out of the Inbox. </p><p>However, if you are deleting and archiving mail that's not new, you've had it a while, so it's likely those emails have already been previously downloaded to the Pop account. Then that will have no effect on the Pop account. It cannot synchronise with server Inbox because it's a Pop account. </p><p>Hope this information helps. </p><p>But you need to clarify  this statement ""I want it to download emails that have <strong>not been archived</strong>,"" </p><p>If they have 'not been archived' then in theory they are in the imap Inbox folder and also in the webmail account 'Inbox'.  Are those emails in the gmail imap Inbox and webmail Inbox? Or have you moved them into another folder for organising ? </p><p>If they have no been previously downloaded to the Pop account, then are you saying nothing is downloading to the Pop account? </p>",Toad-Hall,False,0,0
1816248,1580121,2026-05-06 00:39:55 -0700,2026-05-06 00:39:55 -0700,<p>Thanks for the responses. My understanding (could be wrong) Gmail uses labels instead of folders.  </p><p>I am hoping someone else might provide some assistance also. </p><p>Art </p>,damurrs,False,0,0
1816273,1580135,2026-05-06 07:36:18 -0700,2026-05-06 07:36:18 -0700,"<p>There appears to be no way to prevent those folders from becoming unsorted.  If you are using TB v140esr, there is also no way to reorder them with a menu choice; you would have to update to v150 for that. </p>",siffemoz,False,0,0
1816380,1580135,2026-05-06 17:09:55 -0700,2026-05-06 17:09:55 -0700,"<p>I am using TB v150.0.1. Using the reorder menu choice sorts the folders in alphabetical order instead of returniung them to my desired manually sorted order.  If there is a manual folder sort function available, then there should be functionality to ensure that once sorted, the folders stay in that order. </p>",arunas2,False,0,0
1816439,1580135,2026-05-06 22:39:07 -0700,2026-05-06 22:39:07 -0700,"<em><p>Arunas Pabedinskas <a href=""#answer-1816380"" rel=""nofollow"">said</a></p></em> <blockquote>I am using TB v150.0.1. Using the reorder menu choice sorts the folders in alphabetical order instead of returniung them to my desired manually sorted order.  If there is a manual folder sort function available, then there should be functionality to ensure that once sorted, the folders stay in that order. </blockquote> <p>Sorry, I misunderstood. Once you sort your folders, they should stay that way after restarting. How many folders and subfolders do you have under Local Folders? </p>",siffemoz,False,0,0
1816614,1580135,2026-05-07 15:37:58 -0700,2026-05-07 15:37:58 -0700,"<p>I have 10 or so folders under Local Folders and several hundred subfolders and sub-subfolders under the main folders to which I have added numbers to the folder names to keep in the desired order.  I am frustrated enough with the folders always rearranging themsleves after I mannually sort them into the preferred order, so I don't have the energy to start manually sorting subfolders. </p>",arunas2,False,0,0
1816961,1580135,2026-05-09 02:58:49 -0700,2026-05-09 02:58:49 -0700,"<em><p>Arunas Pabedinskas <a href=""#answer-1816614"" rel=""nofollow"">said</a></p></em> <blockquote>I have 10 or so folders under Local Folders and several hundred subfolders and sub-subfolders under the main folders to which I have added numbers to the folder names to keep in the desired order.  I am frustrated enough with the folders always rearranging themsleves after I mannually sort them into the preferred order, so I don't have the energy to start manually sorting subfolders. </blockquote> <p>Sort a few folders, then start TB in <a href=""/en-US/kb/troubleshoot-mode-thunderbird"" rel=""nofollow"">Troubleshoot mode</a>. Do the folders remain sorted? </p>",siffemoz,False,0,0
1817026,1580135,2026-05-09 13:24:36 -0700,2026-05-09 13:24:36 -0700,"<p>The order of the manually sorted folders in Local Folders seems to be holding for now, but the manually sorted order of any subfolders keeps resetting to what it was before I sorted them, even after I sort them in trobleshooting mode and run Repair Folder. It would only make sense that there is somewhere in one or more TB settings files that the order of manually sorted folders and subfolders is stored and can be checked to ensure that the manually sorted orders have been saved correctly. If not, then unless you never shut down TB, the manualy sort folders function is an utterly useless function. </p>",arunas2,False,0,0
1816177,1580139,2026-05-05 17:29:22 -0700,2026-05-05 17:29:22 -0700,"<p>Here is a simple way:  - install the addon, importexporttools NG - highlight 'Local Folders'  - rightclick and select the importeport option to export folder.  - select a desired folder on disk and click ok. </p>",davidsk,False,0,0
1816191,1580139,2026-05-05 18:42:13 -0700,2026-05-05 18:42:13 -0700,"<p>David, I'll look into that option. Thanks </p>",dcal53,False,0,0
1818409,1580156,2026-05-14 22:58:50 -0700,2026-05-14 22:58:50 -0700,"<p>As I have never been a gmail user interface user.  I struggle a little with terms like ""how Gmail used to do it"".  I have no real idea how they used to do it. </p><p>But I struggle with lots of things, like understanding why you would need an LLM to sort your mail into folders,  I use filters and have done so for decades.  They do not ""learn""  but they also do not put the wrong things in the wrong place because they think something meaningless is important.  ""Important"" was the first thing I turned off in the gmail interface. </p><p>Have you tried right clicking the folder and simply selecting open in a new tab?  Have you looked at the quickfolder addon.  It has been popular for decades and sounds a lot like tabbed folders. <a href=""https://addons.thunderbird.net/en-US/thunderbird/addon/quickfolders-tabbed-folders/?src=search"" rel=""nofollow"">https://addons.thunderbird.net/en-US/thunderbird/addon/quickfolders-tabbed-folders/?src=search</a> </p>",MattAuSupport,False,0,0
1816203,1580158,2026-05-05 19:50:21 -0700,2026-05-05 19:50:21 -0700,"<p>OK, tried both of those but neither worked. </p>",tonymnace,False,0,0
1816210,1580158,2026-05-05 20:52:09 -0700,2026-05-05 20:52:09 -0700,<p>Try booting to safe mode and then delete them. </p>,davidsk,False,0,0
1816200,1580158,2026-05-05 19:18:37 -0700,2026-05-05 19:18:37 -0700,"<p>What is your operating system? I will assume Windows. Two things I would try: </p><p>- Restart Thunderbird in Troubleshoot Mode (see &lt;Help | Troubleshoot Mode&gt;). This will temporarily disable all add-ons, in case one of them is misbehaving. Now try deleting the accounts. </p><p>- See this conversation about a similar situation. The cause had to do with Thunderbird being originally installed under an operating system Administrator account, but the current user only had regular user permissions. Perhaps you are in a similar position. </p><p><a href=""https://support.mozilla.org/en-US/questions/1344354"" rel=""nofollow"">https://support.mozilla.org/en-US/questions/1344354</a> </p>",rednoise,False,0,1
1816227,1580162,2026-05-05 22:02:21 -0700,2026-05-05 22:22:44 -0700,"<p>Hello there Gjveerman. </p><p><br> </p><p><br> </p><p>The folders might be corrupted, or the index file itself is broken. Are they still visible?No? It might help to run the 'Repair Folder' function on the Inbox folder.This is the fastest way to recover them if the folders exist but are simply not being displayed. </p><p><br> </p><p><br> </p><p><em><strong>Here’s how</strong></em> Files might be collapsed. Click the '&gt;' or '+' icons next to the Inbox in the left pane to expand the folders. </p><p>The next step is to verify your IMAP folder subscriptions. Right-click your email account, select 'IMAP Folders' (or 'Subscribe'), and click 'Query'. Locate the missing folders in the list and ensure they are subscribed to restore visibility. </p><p><br> </p><p><em><strong>Here’s how 2</strong></em> Right-click on Inbox &gt; select Properties. Click the Repair Folder button and then click OK. Thunderbird will now rebuild the index.Did anything specific happen recently that might have caused this? </p>",Googlethunderbird.,False,0,0
1816622,1580165,2026-05-07 15:45:00 -0700,2026-05-07 15:45:00 -0700,<p>I opened Notepad. I cannot find the Trash file. </p>,lpvmc,False,0,0
1816677,1580165,2026-05-07 17:09:20 -0700,2026-05-07 17:09:20 -0700,"<em><p>david <a href=""#answer-1816633"" rel=""nofollow"">said</a></p></em> <blockquote> - if the trasn folder is in Local Folders, click the Mail folder and then the Local Folders folder and somewhere there is trash, trash.msf. open the trash file. </blockquote> <p>@david: Leo deleted several subfolders from his Local Folders. The corresponding mbox files of those deleted subfolders should now be located in a <strong>Trash.sbd</strong> file folder in Local Folders in Mail. So Leo should look up the contents of Trash.sbd, too, even if the chance to retrieve his deleted subfolders (and messages) is near zero. </p>",Mapenzi,False,0,0
1816615,1580165,2026-05-07 15:38:55 -0700,2026-05-07 15:38:55 -0700,"<p>If the trash folder appears empty, yet is 240 mb, then messages that have been marked 'delete' are still there. You can check that by exiting thunderbird, and then open the trash file (NOT the trash.msf file) with notepad. Do a screenshot of what you see. </p>",davidsk,False,0,0
1816567,1580165,2026-05-07 13:49:03 -0700,2026-05-07 13:49:03 -0700,<p>Any Thunderbird profile backup or of your personal data on an external hard disk or even on another partition? </p>,Mapenzi,False,0,0
1816593,1580165,2026-05-07 14:35:58 -0700,2026-05-07 14:35:58 -0700,"<p>Check the size of the trash folder. if it has not been compressed, the messages may be recoverable. </p>",davidsk,False,0,0
1816599,1580165,2026-05-07 14:54:18 -0700,2026-05-07 14:54:18 -0700,"<p>Mapenzi/David, </p><p>Thanks for your (quick) responses. </p><p>Size on disk: 240 mb.  In the same window it says I can click a button to repair msf files. Is that a possible solution? </p><p>Cannot find the Thunderbiord Profile back up. </p><p>I looked for Local folders in Mozilla Thunderbird &gt; Program Files: nothing there. </p><p>KR, Leo. </p>",lpvmc,False,0,0
1816605,1580165,2026-05-07 15:11:23 -0700,2026-05-07 15:11:23 -0700,"<p>NO. ""repairing' will compress.. if trash folder is not compacted or repaired, it may still have content. check its size. the msf files are not the concern. </p>",davidsk,False,0,0
1816611,1580165,2026-05-07 15:23:19 -0700,2026-05-07 15:23:19 -0700,"<p>The only size I see opening the Properties of the Trash folder is: size on disk 240 mb.  </p><p>A while back I had to install a new version of Thunderbird (I think) and after the installation there were no local folders. One of the helpers on this forum helped me to recover them using the C &gt; Users &gt; 'My name'&gt; AppData &gt; Thunderbird &gt; profiles. can I find a back up in one of the four folders there? </p><p>KR, Leo. </p>",lpvmc,False,0,0
1816683,1580165,2026-05-07 17:32:28 -0700,2026-05-07 17:32:28 -0700,"<p>THANK YOU, @mapenzi. I admit to stumbling with .sbd folders. :) </p>",davidsk,False,0,0
1816209,1580165,2026-05-05 20:49:23 -0700,2026-05-05 20:49:23 -0700,"<p>check the trash folder.. If it has not been compressed, they may still be available. You can check from File Explorer to see size of the file. Let us know. </p>",davidsk,False,0,0
1816564,1580165,2026-05-07 13:40:34 -0700,2026-05-07 13:40:34 -0700,"<p>Unfortunately nothing in the trash folder.  </p><p>Other suggestions? </p><p>Kr, Leo. </p>",lpvmc,False,0,0
1816807,1580165,2026-05-08 11:17:59 -0700,2026-05-08 11:17:59 -0700,"<em><p>lpvmc <a href=""#answer-1816804"" rel=""nofollow"">said</a></p></em> <blockquote>I found the Trash.sbd in the Profiles folder &gt; Default release &gt; Root directory &gt; Mail &gt; Trash.sbd. </blockquote> <p>It should have been ... Profiles folder &gt; Default release &gt; Root directory &gt; Mail &gt; <strong>Local Folders</strong> &gt; Trash.sbd But I assume that that you just forgot to mention one step in the path .... </p>",Mapenzi,False,0,0
1816208,1580165,2026-05-05 20:47:19 -0700,2026-05-05 20:47:19 -0700,"<p>Normally if you delete folders or subfolders in Thunderbird they would be moved to the Trash folder, in your case the Trash folder in Local Folders. Did you search the Trash folder? If they are no longer in Trash you could retrieve them from a profile backup, if you have one... </p>",Mapenzi,False,0,0
1816633,1580165,2026-05-07 16:07:14 -0700,2026-05-07 16:07:14 -0700,"<p>It is in the profile folder. click help&gt;troubleshootinginformation, - then, click 'profile folder' and click 'open folder' - if the trasn folder is in Local Folders, click the Mail folder and then the Local Folders folder and somewhere there is trash, trash.msf. open the trash file. </p>",davidsk,False,0,0
1816806,1580165,2026-05-08 11:17:41 -0700,2026-05-08 11:17:41 -0700,"<p>So, the trash.sbd folder was empty? I regret your loss. </p>",davidsk,False,0,0
1816804,1580165,2026-05-08 11:12:03 -0700,2026-05-08 11:12:03 -0700,"<p>I found the Trash.sbd in the Profiles folder &gt; Default release &gt; Root directory &gt; Mail &gt; Trash.sbd. </p><p>Unfortunately there is nothing more than there is in the Local folders. </p><p>I assume this is it? It is all gone? </p><p>Thanks for all your help, it is much appreciated. </p><p>Kindest regards, Leo. </p>",lpvmc,False,0,0
1816820,1580165,2026-05-08 11:56:13 -0700,2026-05-08 11:56:13 -0700,"<p>Yep, I did. </p>",lpvmc,False,0,0
1816212,1580171,2026-05-05 20:57:08 -0700,2026-05-05 20:57:08 -0700,"<p>If you have suggestions, please do that at <a href=""http://connect.mozilla.org"" rel=""nofollow"">connect.mozilla.org</a>, under the category of IDEAS. Personally, I have never had a problem with manual setups. Good luck. Providing details on the account and the messages would be helpful to ensure the developers see the specific issue. thank you </p>",davidsk,False,0,0
1816238,1580171,2026-05-05 23:21:14 -0700,2026-05-05 23:26:56 -0700,"<p>Hello there </p><p><br> </p><p><em><strong>Very recognisable </strong></em>. The Thunderbird autoconfig (and the Flatpak sandbox) tends to be 'too smart' for its own good, overwriting values as soon as you switch fields—it really is a game of 'whack-a-mole. </p><p>The solution that works for me:Click on 'Manual Configuration'.Fill in the Port and SSL settings first (at the bottom).Only then fill in the server names and usernames (at the top).If you set the ports last, Thunderbird often triggers a 're-calculation,' which causes the server settings to jump back to their defaults.Regarding the blank error message: this is often a permissions issue within the Flatpak sandbox, preventing Thunderbird from properly displaying or writing the specific error string. </p><p><em><strong>Tip</strong></em> Tip for SMTP: Check under Account Settings -&gt; Outgoing Server (SMTP) to ensure the port isn't stuck on 25 (it usually needs to be 465 or 587 with SSL/TLS). </p><p>Could you please provide the information previously requested? </p>",Googlethunderbird.,False,0,0
1816263,1580176,2026-05-06 06:06:59 -0700,2026-05-06 06:06:59 -0700,"<p>My thoughts about the second, ""too full"" account...  </p><p>- Are you getting error messages telling you the account is too full? Please quote the error message exactly, in full, verbatim. A screen shot would suffice. Do you know what your storage limit is? </p><p>- is this a POP3 account or IMAP? If POP3, is it set up to leave messages on the server after downloading? </p><p>- Are you caught up, that is, have you downloaded all available messages to date? </p>",rednoise,False,0,0
1816216,1580181,2026-05-05 21:29:51 -0700,2026-05-05 21:29:51 -0700,"<em><p>Rose <a href=""#question-1580181"" rel=""nofollow"">said</a></p></em> <blockquote>One of my email accounts will not connect. It was working but has not connected for two days. The message says log in failed for </blockquote>",rosemarierussell33,False,0,0
1816291,1580187,2026-05-06 08:29:32 -0700,2026-05-06 08:29:32 -0700,"<p>You'll also have to allow cookies <strong>in Thunderbird</strong>. See <a href=""https://support.mozilla.org/kb/microsoft-oauth-authentication-and-thunderbird-202"" rel=""nofollow"">https://support.mozilla.org/kb/microsoft-oauth-authentication-and-thunderbird-202</a> </p>",christ1,False,1,0
1816860,1580187,2026-05-08 16:47:48 -0700,2026-05-08 16:47:48 -0700,"<p>Thanks, I had no exclusion and it was already checked to ""Accept cookies"". I was able to make it work by using <a href=""http://outlook.office365.com"" rel=""nofollow"">outlook.office365.com</a>:143 with starttls/OAuth2. That account has 2FA enabled. Sending through <a href=""http://outlook.office365.com"" rel=""nofollow"">outlook.office365.com</a>:587 </p>",sunphoenix,False,0,0
1816871,1580187,2026-05-08 17:39:34 -0700,2026-05-08 17:39:34 -0700,"<p>As per the support article linked above, the correct settings for the incoming server would be: </p><p><a href=""http://outlook.office365.com"" rel=""nofollow"">outlook.office365.com</a>, port 993 for IMAP Connection security: SSL/TLS Authentication method: OAuth2 </p>",christ1,False,0,0
