id,question_id,created,updated,content,creator,is_spam,num_helpful,num_unhelpful
1817621,1581135,2026-05-11 20:26:23 -0700,2026-05-11 20:26:23 -0700,"<p>Hello, I enter the email address manually, In your case, can you not manually enter the email address in those fields? </p><p>Thanks </p>",pcp04,False,0,0
1817606,1581135,2026-05-11 19:15:08 -0700,2026-05-11 19:15:08 -0700,"<p>Hello,  Yes, it is possible. Attached is a screenshot of a filter to forward incoming emails from a specific Gmail account to another Hotmail account. </p>",pcp04,False,0,0
1817611,1581135,2026-05-11 20:07:43 -0700,2026-05-11 20:07:43 -0700,"<p>Yes, but how did you enter the email address?  I can only see other email addresses that Thunderbird picks up. I want to forward the email to my wife's account (which I do not pick up). I cannot see a way to enter a new address. thanks </p>",sghalliday,False,0,0
1817629,1581135,2026-05-11 20:47:33 -0700,2026-05-11 20:47:33 -0700,"<p>Ah, OK.  I missed the forward to option. I was trying to copy to. Thanks for your help ..steve </p>",sghalliday,False,0,0
1817976,1581138,2026-05-13 08:17:42 -0700,2026-05-13 08:17:42 -0700,"<p>Volgens mij is de oplossing bij deze vraag <a href=""https://support.mozilla.org/nl/questions/1569655"" rel=""nofollow"">https://support.mozilla.org/nl/questions/1569655</a> voor u ook van toepassing. </p>",Mozilla-assistent,False,0,0
1817789,1581138,2026-05-12 12:21:19 -0700,2026-05-12 12:21:19 -0700,"<p>Dit gaat om emailberichten die ik wil verzenden in Thunderbird, denk ik </p>",samnijk,False,0,0
1817765,1581138,2026-05-12 10:58:52 -0700,2026-05-12 10:58:52 -0700,<p>Gaat dit om webmail in Firefox of om e-mailberichten in Thunderbird? </p>,Mozilla-assistent,False,0,0
1817600,1581141,2026-05-11 18:53:26 -0700,2026-05-11 18:53:26 -0700,"<p>in account settings pane, highlight the desired account in left sidebar. Then, click the 'managed identities' button in right side. There, you can enter the same email info, but with a fancier signature (I do that). Then, when composing a message, you can click the FROM dropdown an select the fancier email. </p>",davidsk,False,0,0
1817601,1581144,2026-05-11 18:56:17 -0700,2026-05-11 18:56:17 -0700,<p>More detail needed. What is meant by 'select the signature'? can you do a screenshot of the 'composition&amp;addressing' pane of the account? That may help. thank you </p>,davidsk,False,0,0
1817605,1581144,2026-05-11 19:07:23 -0700,2026-05-11 19:07:23 -0700,"<p>I have to select the settings for the account then select the choose button for signature file, then select the signature file for the email account. See screenshots. </p>",jvanhout,False,0,0
1817801,1581144,2026-05-12 13:38:33 -0700,2026-05-12 13:38:33 -0700,"<p>David, Thanks for the feedback and suggestion. it seems to have fixed the issue. Appreciated </p>",jvanhout,False,0,0
1817617,1581144,2026-05-11 20:23:04 -0700,2026-05-11 20:23:04 -0700,<p>Have you tried putting the signature file local to the profile? This appears to be a network issue. </p>,davidsk,False,0,0
1817810,1581144,2026-05-12 14:37:08 -0700,2026-05-12 14:37:08 -0700,<p>You're welcome. I was glad to assist. </p>,davidsk,False,0,0
1817803,1581147,2026-05-12 13:40:45 -0700,2026-05-12 13:40:45 -0700,"<p>Dit zult u bij de provider Ziggo moeten regelen, zie: <a href=""https://community.vodafoneziggo.nl/t5/Internet/Oude-chello-mailadres-verwijderen-Hoe-doe-ik-dit/td-p/86009"" rel=""nofollow"">https://community.vodafoneziggo.nl/t5/Internet/Oude-chello-mailadres-verwijderen-Hoe-doe-ik-dit/td-p/86009</a>. </p>",Mozilla-assistent,False,0,0
1817613,1581152,2026-05-11 20:11:08 -0700,2026-05-11 20:11:08 -0700,"<p>Go here:  <a href=""https://www.thunderbird.net/en-US/donate/help/"" rel=""nofollow"">https://www.thunderbird.net/en-US/donate/help/</a>   and click the option 'I need help with something else' and a dropdown window should open where you can write your request.  Let us know if this does not work. thank you for your years of support. :) </p>",davidsk,False,0,0
1817726,1581154,2026-05-12 07:07:21 -0700,2026-05-12 07:07:21 -0700,<p>Vai in Tasto menu &gt; Impostazioni account Nella colonna a sinistra trascina con il mouse il nome di un account nella posizione in cui vuoi che compaia. </p>,@next,False,0,0
1817610,1581160,2026-05-11 20:05:20 -0700,2026-05-11 20:05:20 -0700,<p>are you saying that view&gt;folders&gt;tags is not an option on your computer? </p>,davidsk,False,0,0
1817638,1581160,2026-05-11 21:05:33 -0700,2026-05-11 21:05:33 -0700,<p>view&gt;folders&gt;tags is there but empty </p>,bugcsilla,False,0,0
1817782,1581160,2026-05-12 11:50:00 -0700,2026-05-12 11:50:00 -0700,"<p>You might try installing a new download over the top of current install, on the possibility that a file was corrupted. I've never seen the tags folder without the tag categories visible. Good luck. </p>",davidsk,False,0,0
1817669,1581175,2026-05-12 00:02:38 -0700,2026-05-12 00:02:38 -0700,"<p>If it's a well-known email provider, Thunderbird may know the proper server settings based on your email address, and do a good basic job of setting it up for you. You will be prompted through this when you first install Thunderbird. After that, go to &lt;Account Settings&gt; and click the ""New Account"" button. </p><p>If this is a less well-know provider or the automatic process fails, gather the correct settings from their support web site. You will need to know: </p><p>for incoming: Protocol (IMAP, in this case) Hostname/server name Port Connection security (STARTTLS or SSL/TLS) Authentication method (usually Normal Password or OAuth2) </p><p>Same info needed for the outgoing (SMTP) server. </p><pre>Then start the New Account process, and after you enter your email address, you'll be presented with a ""Configure manually"" option where you can enter the server information you gathered. </pre>",rednoise,False,0,0
1817740,1581180,2026-05-12 08:19:31 -0700,2026-05-12 08:19:31 -0700,"<p>- Make sure cookies are allowed in Thunderbird </p><p>- Do not use a VPN while attempting to authenticate your Google account </p><p>- Make sure there is no application running on your computer which is blocking local TCP port 80, e.g. a local web server </p>",siffemoz,False,0,0
1817680,1581184,2026-05-12 01:14:07 -0700,2026-05-12 01:14:07 -0700,"<p>I can confirm that this happens in Windows with Thunderbird 150.0.2, though not as severely as what you see (see image below.) The two buttons are partly out of the dialog box, but at least I can get at them with the mouse. I'd call this an interface bug. Hopefully they are aware of it and I expect it should be an easy fix for them. </p>",rednoise,False,0,0
1817739,1581199,2026-05-12 08:12:34 -0700,2026-05-12 08:12:34 -0700,<p>Who is your email provider? Please post a screenshot of the SMTP configuration with your personal info redacted. </p>,siffemoz,False,0,0
1817900,1581203,2026-05-12 19:35:45 -0700,2026-05-12 19:35:45 -0700,<p>Has anyone tried what Lin mentioned about version 115 not reading 110 profile correctly  ? </p>,telebob1,False,0,0
1817910,1581203,2026-05-12 20:38:15 -0700,2026-05-12 20:38:15 -0700,<p>Hi  Better to look  at the wording of Lin's kind  answer : </p><p>. . . .  Profile probably can't the used in 115 any more because some of its data file formats <strong>may</strong> have changed. </p><p>i added the quotation marks  Bold doesnt work </p><p>Keyword is <em>MAY</em> . </p><pre>Implies that she was  not certain. </pre> <p>So thats why I posted for clarification Im glad people here are helpful. And Lin was kind enough to help and reply. </p><p>No reason to attack me. I had a valid reason to post in order  to get clarification  . </p><pre>. </pre>,telebob1,False,0,0
1817906,1581203,2026-05-12 20:11:45 -0700,2026-05-12 20:11:45 -0700,"<p>What do you mean by a 110 profile?  Lin is giving you great advice, and you're challenging his correctness? He told you that thunderbird has no problem going UP, but can have problem if reverting to older releases. </p>",davidsk,False,0,0
1817738,1581203,2026-05-12 08:11:20 -0700,2026-05-12 08:11:20 -0700,"<em><p>telebob1 <a href=""#answer-1817715"" rel=""nofollow"">said</a></p></em> <blockquote>But that Thunderbird Version 115.18.0  does not run on Win 11.   </blockquote> <p>It does. I'm running 115.18.0 portable on Win11. </p>",siffemoz,False,0,0
1817715,1581203,2026-05-12 06:04:49 -0700,2026-05-12 06:04:49 -0700,<p>But that Thunderbird Version 115.18.0  does not run on Win 11.  </p><pre>so how can i copy that Thunderbird version  to my Win 11 Machine and get it to work ??? ? </pre>,telebob1,False,0,0
1817915,1581203,2026-05-12 21:19:46 -0700,2026-05-12 23:13:11 -0700,"<em><p>telebob1 <a href=""#answer-1817910"" rel=""nofollow"">said</a></p></em> <blockquote>Hi  Better to look  at the wording of Lin's kind  answer :  . . . .  Profile probably can't the used in 115 any more because some of its data file formats <strong>may</strong> have changed.  i added the quotation marks  Bold doesnt work  Keyword is <em>MAY</em> .  Implies that she was  not certain. So thats why I posted for clarification Im glad people here are helpful. And Lin was kind enough to help and reply.     No reason to attack me. I had a valid reason to post in order  to get clarification  .  . </blockquote> <p>He/me was/is certain. Ver 150.x can read a 115.x profile - I tried it myself. Data files will be converted to the current formats. 115x will almost certainly have trouble of some kind with a 150x profile. The password database, for one, has changed. I did not try this myself. </p><p>Upgrading isn't a problem. Downgrading can be a problem. If you think you may want to downgrade, keep a safety backup copy of your 115 Profile. You should be making regular backups of your Profile anyway. </p>",rednoise,False,0,0
1817706,1581203,2026-05-12 05:26:38 -0700,2026-05-12 05:26:38 -0700,"<p>The last version of Thunderbird to support Windows 7 is 115.18.0 . It can be downloaded here: </p><p><a href=""https://www.thunderbird.net/en-US/thunderbird/all/"" rel=""nofollow"">https://www.thunderbird.net/en-US/thunderbird/all/</a> </p><p>When you eventually are ready to move to Windows 11, I suggest that you install that same version there, then copy your Profile from the Win7 machine to the 11 machine. After you're comfortable that it's working the way you like, THEN upgrade Thunderbird. </p>",rednoise,False,0,0
1817741,1581203,2026-05-12 08:23:04 -0700,2026-05-12 08:23:04 -0700,"<p>Well, it runs on Windows 10, and I have yet to find anything that runs on 10 that won't run on 11. </p><p>And you won't be copying the whole program from the 7 computer to the 11. You'll just be copying your Thunderbird Profile, which is the folder that contains all your personal data (messages, folders, email account info, passwords, etc.) </p><p>But now that I think about it some more, I'm not sure there's any real advantage to installing the older version on Windows 11. The Profile from a newer version will probably not be compatible with an older version of the program, but a newer version would probably work fine with an older Profile. I will test that theory tomorrow and report back. </p>",rednoise,False,0,0
1817837,1581203,2026-05-12 16:50:21 -0700,2026-05-12 16:50:21 -0700,"<p>Just to complete the above thought - Thunderbird version 150..0.2 has no problem using a Profile created by version 115.18.0 . But once opened in 150, the Profile probably can't the used in 115 any more because some of its data file formats may have changed. </p>",rednoise,False,0,0
1817737,1581216,2026-05-12 08:07:32 -0700,2026-05-12 08:07:32 -0700,"<p>Duplicate of <a href=""https://support.mozilla.org/en-US/questions/1580936"" rel=""nofollow"">https://support.mozilla.org/en-US/questions/1580936</a>. </p>",siffemoz,False,0,0
1817751,1581222,2026-05-12 09:06:42 -0700,2026-05-12 09:25:19 -0700,"<p>Hello there Alan </p><p><br> </p><p>Could you elaborate on the context in which this error occurred? <a href=""https://support.mozilla.org/en-US/kb/cannot-send-messages"" rel=""nofollow"">https://support.mozilla.org/en-US/kb/cannot-send-messages</a> </p><p><br> Are there any additional UI discrepancies, or have any specific error messages populated? Please audit the recent SMTP configuration to confirm functionality. </p><p><br> <em><strong>Use</strong></em> <a href=""https://support.mozilla.org/en-US/kb/how-to-make-screenshots"" rel=""nofollow"">https://support.mozilla.org/en-US/kb/how-to-make-screenshots</a> </p>",Googlethunderbird.,False,0,0
1817785,1581242,2026-05-12 12:02:13 -0700,2026-05-12 12:02:13 -0700,<p>In the menu bar go to View &gt; Headers and put a tick against ✔ Normal </p>,Mapenzi,False,0,0
1818014,1581250,2026-05-13 11:42:33 -0700,2026-05-13 11:42:33 -0700,"<p>Sorry, but the video is not viewable. See info: <a href=""https://help.imgur.com/hc/en-us/articles/41592665292443-Imgur-access-in-the-United-Kingdom"" rel=""nofollow"">https://help.imgur.com/hc/en-us/articles/41592665292443-Imgur-access-in-the-United-Kingdom</a> </p><p>Please provide some info so we can check if there's  a bug report and understand all the settings you are using.  </p> <ol><li> What OS are you using ? </li><li> What version of Thunderbird are you using? </li><li> Where did you get the Thunderbird installation eg: the official Thunderbird website: <a href=""https://www.thunderbird.net/en-US/thunderbird/all/"" rel=""nofollow"">https://www.thunderbird.net/en-US/thunderbird/all/</a>    Or did you get it via Windows App Store or Flatpak or Snap etc? </li><li> What language version of Thunderbird are you using? </li><li> What Timezone is computer set up to use? </li><li> Did this issue suddenly occur after an update? </li><li> Do you use any addons ? </li></ol> <p>Please post info you see in the following location: </p> <ul><li> 'Help' &gt; 'Troubleshooting Information' </li><li> Scroll down to the 'Add-ons' section </li><li> Copy all the list and paste it into this forum question. </li></ul> <p>Now check the following whilst still using/seeing the 'Troubleshoot Information' tab. </p> <ul><li> top right where it says 'Diagnose Issues' - click on 'Troubleshoot Mode' -  </li><li> Select 'Continue in Troubleshoot Mode' </li></ul> <p>Thunderbird will restart in Troubleshoot mode, so you may see some default settings appear - do not worry about it. </p> <ul><li> In Calendar, click on 'New Event' </li><li> Create a test event. </li><li> Please use the drop down to select Month, date </li><li> Do the same to select the Time - use the drop down - note you need to select the Hour and the minutes options. </li></ul> <p>Is everything working whilst in Troubleshoot Mode ? </p><p>Tell us what is set up as default Calendar settings: </p> <ul><li> Settings &gt; Calendar </li><li> Please post a couple of images to show all the current Calendar default settings. </li></ul>",Toad-Hall,False,0,0
1817807,1581251,2026-05-12 14:17:06 -0700,2026-05-12 14:19:17 -0700,"<p>1. Preverte tieto hodnoty v Thunderbirde: Nástroje → Nastavenia účtu → Odchádzajúci server (SMTP) skontrolujte: Používateľské meno = CELÁ gmail adresa OAuth2 SSL/TLS port 465 </p><p>2. Vymažte všetky uložené heslá pre gmail: Nastavenia → Súkromie a bezpečnosť → Heslá → Uložené heslá vyhľadajte: oauth://accounts.google.com <a href=""http://smtp.gmail.com"" rel=""nofollow"">smtp.gmail.com</a> <a href=""http://imap.gmail.com"" rel=""nofollow"">imap.gmail.com</a> - najskôr si údaje niekam zapíšte a potom všetko pre Gmail odstráňte. </p><p>3. Thunderbird úplne ukončite a znovu spustite. </p><p>4. Pri prvom odoslaní mailu by sa malo objaviť prihlasovacie okno gmail. prihláste sa a potvrďte prístup pre Thunderbird. </p><p>5. Ak sa prihlasovacie okno gmail vôbec neobjaví, býva problém často v: zablokovaných cookies, rozšírení, poškodenom profile Thunderbirdu, alebov  antivíre kontrolujúcom SSL spojenia. </p>",Ansamb,False,0,0
1817769,1581252,2026-05-12 11:03:39 -0700,2026-05-12 11:03:39 -0700,"<p>Lukt het installeren van Thunderbird niet, of lukt het niet om een account toe te voegen? Er zijn op dit platform verschillende artikelen om dit op te lossen: <a href=""https://support.mozilla.org/nl/products/thunderbird#search"" rel=""nofollow"">https://support.mozilla.org/nl/products/thunderbird#search</a>. </p>",Mozilla-assistent,False,0,0
1818023,1581253,2026-05-13 12:16:33 -0700,2026-05-13 12:16:33 -0700,"<p>Image shows you have a folder which has a .mbox written at the end. Thunderbird does not the extension.mbox for it's files, so you would need to check what is actually stored in the profile in the Local Folders folder.  It's possible that extension is causing an issue in the name of the file. </p><p>Thunderbird mbox files  </p><p>If you have an Imap gmail account and subcribe to see the 'All Mail' folder, then you will already have a download of the 'All Mail' contents stored in Thunderbird in an mbox file. </p><p>Imap accounts cannot and should not be relied upon as a true independent copy because it synchronises with the server. </p><p>However, if you have the settings to download full copies for the 'All Mail' folder: </p> <ul><li> In Account Settings &gt; Synchronisation &amp; Storage for the gmail account </li><li> Select 'keep messages in all folders for this account on this computer' </li><li> click on 'Advanced' button and make sure all folders are selected in particular the 'All Mail' folder. </li><li> Select 'Synchronise all messages locally regardless of age' </li></ul> <p>Then Thunderbird will have downloaded full copies of all emails including their attachments. </p><p>You can then do the following to create a backup in the Local Folders' account which is a copy on your computer and it does not synchronise with server. </p> <ul><li> Exit Thunderbird </li><li> In windows search type: %Appdata% </li><li> select the %Appdata% file folder </li><li> Select 'Roaming' </li><li> You should see a 'Thunderbird' folder. </li></ul> <p>Please note if you want a full backup of everything in Thunderbird -profiles, mail accounts, emails, calendar, address books, preferences etc - then make a copy of the 'Thunderbird' folder and paste to store on an external drive as a backup.  Otherwise: </p> <ul><li> Select 'Thunderbird' </li><li> Select' Profiles' </li><li> Select the profile name folder </li><li> Select 'ImapMail' folder </li><li> Select imap gmail account name folder </li><li> Copy the 'All Mail' file - it will have no extension, but it is an mbox text file. All emails are written to it in the order downloaded one after the other. </li></ul> <ul><li> Go  back up directory to the 'profile name' folder </li><li> Select  'Mail' folder </li><li> Select 'Local Folders' folder </li><li> paste the 'All Mail' file into the Local Folders folder. </li></ul> <p>(If you subsequently past more 'All MAil' files then suggest you do not overwrite the original - maybe rename each with a date.) </p><p>When you restart Thunderbird you should see a folder called eg: All Mail-May-26 </p>",Toad-Hall,False,0,0
1818065,1581253,2026-05-13 14:56:19 -0700,2026-05-13 14:56:19 -0700,"<p>Hi Toad-Hall, </p><p>Thank you very much for such a complete reply.  There is quite a bit I don't understand very well about the email system but let me study what you have written and try a few things.  Then I'll return to you. </p><p>My main aim with all this is to reduce the number of emails stored on Google so as soon as I back them up to Thunderbird, I delete the mails from Gmail.  I'd like to keep the archived emails on my hard disk and use Thunderbird to search through them from time to time.  Eventually I'll keep only recent mails on Gmail and read all the historical emails on Thunderbird.  (Maybe your procedure does that but I need to study more) </p><p>My take is that if I synchronize Gmail with Thunderbird and I delete message from Gmail they will also be deleted on Thunderbird.  But I'm not sure if this is correct. </p><p>Working on it! </p><p>Danz </p>",donlf,False,0,0
1817869,1581265,2026-05-12 17:53:48 -0700,2026-05-12 17:53:48 -0700,<p>You need to log onto your web account and set that IMAP or POP is allowed. </p>,davidsk,False,0,0
1817814,1581266,2026-05-12 15:01:28 -0700,2026-05-12 15:01:28 -0700,"<p>Use the URL of <a href=""https://www.thunderbird.net/en-US/thunderbird/all/"" rel=""nofollow"">https://www.thunderbird.net/en-US/thunderbird/all/</a> where you can download any of the four official releases: ESR, monthly, beta, or daily </p>",davidsk,False,0,0
1817882,1581266,2026-05-12 18:19:10 -0700,2026-05-12 18:19:10 -0700,"<p>Tb 142.0 is a old Release from August 19, 2025 while the Tb 150.0 is the current Release and Tb 140.10.2esr is the current Tb 140.0 ESR.  </p><p><a href=""https://www.thunderbird.net/thunderbird/releases/"" rel=""nofollow"">https://www.thunderbird.net/thunderbird/releases/</a> </p><p>Whatever third-party source you are trying to download the old Tb 142.0 from may actually be pointing to the current Release. </p>",James,False,0,0
1817880,1581273,2026-05-12 18:15:50 -0700,2026-05-12 18:15:50 -0700,"<blockquote> Manual IMAP configuration with both <a href=""http://smtp-mail.outlook.com"" rel=""nofollow"">smtp-mail.outlook.com</a> and <a href=""http://smtp.outlook.com"" rel=""nofollow"">smtp.outlook.com</a> as outgoing server OAuth2 authentication </blockquote> <p>Why manual? Why don't you let Thunderbird automatically pick the correct server names? Follow the instructions in this support article, and use the correct outgoing server name. <a href=""https://support.mozilla.org/kb/microsoft-oauth-authentication-and-thunderbird-202"" rel=""nofollow"">https://support.mozilla.org/kb/microsoft-oauth-authentication-and-thunderbird-202</a> </p> <blockquote> Enabled 2FA on my Microsoft account and generated an App Password </blockquote> <p>With OAuth2 authentication you cannot use an app password. Use your main account password. </p>",christ1,False,0,0
1817844,1581274,2026-05-12 17:03:07 -0700,2026-05-12 17:03:07 -0700,"<p>This curse was visited upon us in the summer of 2022, with release 102. The 'good news' today is that, at least for new folders, you can set the default at settings&gt;appearance , but for existing folders, there is indeed work. Here is my (unofficial) documentation: </p><p><br> This is the official (to my knowledge) documentation. Well worth the read <a href=""https://support.mozilla.org/en-US/kb/message-threading-thunderbird"" rel=""nofollow"">https://support.mozilla.org/en-US/kb/message-threading-thunderbird</a>   </p><p><strong>Simple Approach if just a few folders</strong> Here is my own documentation on threading, duplicating the above, but it may help: You need to highlight each folder and click View&gt;sort by&gt;unthreaded. If this applies to just a few folders, just repeat the process as necessary. If you have many folders or plan to add many new folders, you may wish a different approach, below:  </p><p><strong>FOR NEW FOLDERS</strong>  See Settings&gt;Appearance </p><pre> ------------ </pre> <p><strong>FOR EXISTING FOLDERS</strong>	 These steps may help:  To set many *existing* folders, follow these steps: This must be done on an account by account basis. </p> <ol><li> select table view  - the icon just to right of 'quick filter' button above message list pane </li><li>  select a message folder and apply all desired attributes - View&gt;sort by from menu bar (if not shown, click alt key) </li><li>  click the icon at right side of column display in message list pane </li><li>  select the entry near bottom 'Apply current view to...' </li><li>  highlight 'folder and children' </li><li> move mouse left to see account name and move left again to display all account folders. Now CLICK. a small menu will appear to confirm setting all folders within that account. </li><li> repeat steps for each account </li></ol> <p><strong>FOR FUTURE THUNDERBIRD INSTALLATIONS</strong> </p> <ol><li> -To change default for *new* folders, In config editor, you can change default that applies to NEW folders you set up: </li></ol> <p>mailnews.default_view_flags      0 =unthreaded      (NOTE: Config editor is at settings&gt;general near bottom of pane) </p> <ol><li> - create a simple text file with name of user.js with these lines:  </li></ol> <pre>    // Set default threading to UNthreaded  ###   &lt;== this line is optional, just for documentation     user_pref(""mailnews.default_view_flags"", 0); </pre> <ol><li> - install Thunderbird and exit prior to setting up accounts	  </li><li> - copy the user.js file into the profile </li><li> - now, when you start Thunderbird, unthreading will be the default. Problem solved. # </li></ol>",davidsk,False,0,0
1817816,1581275,2026-05-12 15:03:07 -0700,2026-05-12 15:03:07 -0700,"<p>This is a gmail issue. I suggest you log onto the gmail web account and adjust trash settings there. Allmail folder can be confusing, since it keeps all mail, including deleted trash. </p>",davidsk,False,0,0
1817843,1581275,2026-05-12 17:02:34 -0700,2026-05-12 17:02:34 -0700,<p>Thanks. I am uncertain as to what settings to change. Is it in this area (&gt; shows what is currently selected): </p> <hr> from Settings - Forwarding and POP/IMAP ------------------------- <p>When I mark a message in IMAP as deleted: 	Auto-Expunge on - Immediately update the server. (default) 	&gt; Auto-Expunge off - Wait for the client to update the server. </p><p>When a message is marked as deleted and expunged from the last visible IMAP folder: 	&gt; Archive the message (default) 	Move the message to the Trash 	Immediately delete the message forever </p> <hr> <p>The change of course has to be safe... </p>,steen.jurs,False,0,0
